,summary,link,article,time
122,"Because she ""kind of"" likes her weapons. ",https://fraghero.com/megan-fox-wants-to-play-kitana-in-new-mortal-kombat-film-for-the-weirdest-reason/,"Megan Fox is a well known pop culture face. Not because she’s starred in her own comics or is part of a popular video game, but it’s because she’s played key roles in popular movies such as Transformers and Teenage Mutants Ninja Turtles.

She’s all set to return this summer as April O’Neil in the upcoming Turtles movie titled Teenage Mutant Ninja Turtles: Out of the Shadows. However, Megan isn’t planning to rest and wants to further grow her fan following as she’s looking forward to playing more popular characters, and this time she wants to fill in the boots of a popular fighting game character.

She revealed during an interview with Cinepop when asked if she wanted to play any superhero in a movie, that although she has no idea about a superhero but she’s really keen to play the role of Kitana, the badass hottie from the Mortal Kombat series.

I’ve been getting this question a lot and I should think about it more because I keep drawing a blank. I don’t have a specific superhero that I think I should play. I’m sorry I don’t have a better answer for you I don’t know.

As you all know Kitana isn’t a hero in the series but plays the role of an antagonist. She’s a badass that shows no mercy to her enemies, and is the daughter of Sindel and Shao Khan (adopted).

I thought of Kitana from Mortal Kombat if they ever make that movie again. I’ve always loved her fans and the blades, um, but that’s the only one I could think of.

That’s it, she wants to play the role because, um, she kind of likes the blades. To each their own I guess, but I’ve seen better reasons given by celebs for reprising the roles of fictional pop culture icons in the past. Let’s just leave it at that.

There are whispers that a new Mortal Kombat movie is actually in development and might be helmed by James Wan, who’s directed Fast and Furious 7 among other films. The last Mortal Kombat movie released way back in 1997 and was titled Mortal Kombat: Annihilation.

The film met with a moderate reception and under performed since the original Mortal Kombat movie raked in more revenue at the box office, which is one of the reasons why the series has been in hibernation for so long.

Would you like Megan Fox to play the role of Kitana in the upcoming Mortal Kombat movie?",2016-06-15 21:02:00
123,"Suit: $1,058,600
Vehicles: $79,500,000
Residence and Alfred: $600,285,000
Gadgets and Weapons: $213,610
Training: $1,713,610
Total: $682,770,820 ",http://www.awesomeinventions.com/the-cost-of-being-batman/,"You’ll Never Believe How Much It Would Really Cost To Be Batman

Let's face it who wouldn't want to be Batman? He has the coolest vehicles on earth and his gadgets are out of this world. Have you ever stopped to think though of the actual price involved if you wanted to become a real-life Batman? The folks over at 'MoneySupermarket.com' have and it's pretty scary reading. They estimate that you would need a cool $682 million! Hmm maybe just stick with the Halloween costume this year then. Take a look!

Website: MoneySupermarket

Source: 1",2016-06-15 19:05:00
124,Production staff doesn't communicate about it in written form. ,http://www.cinemablend.com/news/1523960/how-jurassic-world-2-is-keeping-its-secrets-according-to-bryce-dallas-howard,"After the massive success of Jurassic World last summer, its upcoming sequel -- temporarily known as Jurassic World 2 - is without question one of the most anticipated movies currently in development. Of course, that means that the project has to take serious considerations where detail leaks are concerned, and one star has revealed exactly how it's doing that. According to Bryce Dallas Howard, information about Jurassic World 2 is being kept hidden by basically not being communicated about in written form.

The actress recently took part in an early press day for her upcoming movie Pete's Dragon, and I had the pleasure of sitting down with her for an interview. After a long discussion about her work on the Disney movie (more on that in a bit), we concluded the chat talking about Jurassic World 2 and director J.A. Bayona taking the helm. Bryce Dallas Howard mentioned that she's been communicating with the filmmaker, and that she was actually going to be seeing Jurassic World director/producer Colin Trevorrow later that day, but also noted that it's weird talking about the sequel because of the restrictions on communication. She explained,

Whenever I have the chance to be around that group, that crew I like get information. [laughter] J.A.'s over in Europe right now, so I haven't seen him in person. I'm sure he wouldn't... because you know what, the emailing and texting, you can't go on record. You can't write anything down, commit to anything in writing. So, tonight I'll just be like, 'Can you verbally explain to me what's happening?' But we'll shoot it next year.

Studios and filmmakers are constantly looking for ways to prevent details about their upcoming projects leaking to the public, and one could see this being a very effective way. Sure, one can imagine that there's a risk of some material getting scrambled if stuff isn't being written down, but not putting anything in texts, emails or memos means that nobody is going to see material they aren't going to see (and at the most extreme level, it's safe from hackers).

Jurassic World 2 has been seriously in the works for a while now, with J.A. Bayona coming aboard about four months ago. As Bryce Dallas Howard mentioned, the plan is to start filming next year, with Universal Pictures having put a flag in a June 22, 2018 release date. Howard will reprise her role as Claire Dearing, and Chris Pratt will be back as Owen Grady, and while Colin Trevorrow told us that a big theme of the movie will be the proliferation of dinosaurs, not much is known beyond that.

We'll hopefully have more news for you about Jurassic World soon, but you can next see Bryce Dallas Howard in theaters in Pete's Dragon, which will be arriving in theaters on August 12th.",2016-06-15 14:57:00
125,"Horned Serpent, Wampus, Thunderbird, and Pukwudgie. ",http://fanfest.com/2016/05/11/americas-hogwarts-houses-names-revealed/,"We all know of the legendary Gryffindor, Ravenclaw, Hufflepuff and Slytherin, the four houses at the Hogwarts School of Witchcraft and Wizardry. What about the new American wizard school in Fantastic Beasts and Where to Find Them?

Ilvermorny is the name of the school and the four houses are: Horned Serpent, Wampus, Thunderbird, and Pukwudgie.

The Horned Serpent is a dragon-like serpent with long horns and teeth. They are said to be able to control the weather, particularly rain, lightning and thunder. They can shape-shift, turn invisible and perform hypnosis.

Wampus is a cat-like creature that is pretty much a very scary looking cougar.

Thunderbirds are legendary birds that can generate storms and thunder when they fly. A Pukwudgie is a 2-3 foot tall human like thing with exaggerated ears, fingers, and nose. They have smooth grey skin that glows sometimes. They can disappear and reappear, create fire, and transform into either a porcupine or a cougar.

There is still more to learn about these houses and Ilvermorny. We’ll find out more November 18, 2016 when Fantastic beasts charms its way into theaters.

Want MORE updates on Harry Potter, Fantastic Beasts & MORE! CLICK HERE and Follow Us on Facebook!

source: comicbook.com",2016-06-15 10:30:00
126,"You mean the guy who looks exactly like Hugh Jackman?
It's Hugh Jackman.
",http://www.thesun.co.uk/sol/homepage/features/7177762/Youll-never-guess-who-this-brainy-Hollywood-star-is-from-their-degree-snap.html,"TONY PARSONS There is no deal to be had with Putin - ultimately, it will be him or us",2016-06-14 14:24:00
127,Olivia Wilde ,http://hellogiggles.com/youll-never-guess-who-almost-played-marissa-on-the-o-c/,"The O.C. is one of those shows that is quintessentially California, even though most of us who grew up there didn’t have drama-filled lives anything like the characters. But that’s why it’s so fun to watch — it’s an escape from whatever is going on in our lives, and when it was initially on TV the first time, it felt like a soap opera for our generation. It’s also a show that’s easy to binge-watch and get lost in over and over (thank you, Netflix!), and apparently, it’s a show that was almost COMPLETELY different.",2016-06-14 11:13:49
128,Silver ribbons. ,http://www.huffingtonpost.com/entry/stars-honor-victims-of-orlando-shooting-on-tony-awards-red-carpet_us_575def73e4b00f97fba8a928,"In the wake of the mass shooting early Sunday morning at a gay nightclub in Orlando, Florida, the theater community paid tribute to the victims of the attack on the red carpet of the 70th Tony Awards. Attendees wore silver ribbons on tuxedo lapels and gowns specially created by costume designer William Ivey Long to honor the at least 50 dead and 53 wounded.

The award show announced earlier in the day that Sunday's ceremony would be dedicated to all those touched by the tragedy.

Advertisement

""Our hearts are heavy for the unimaginable tragedy that happened last night in Orlando,"" the statement read on Twitter. ""Our thoughts are with the families and friends of those affected. The Tony Awards dedicate tonight's ceremony to them.""

Take a look at some red carpet arrivals below:

Jonathan Groff attends the 70th Annual Tony Awards at The Beacon Theatre. Kevin Mazur via Getty Images

Danai Gurira attends the 70th Annual Tony Awards at The Beacon Theatre. Kevin Mazur via Getty Images

Neil Patrick Harris and David Burtka attend the 70th Annual Tony Awards at The Beacon Theatre. Larry Busacca via Getty Images

James Corden and Julia Carey attend the 70th Annual Tony Awards. Larry Busacca via Getty Images

Bebe Neuwirth attends the 70th Annual Tony Awards at The Beacon Theatre. Dimitrios Kambouris via Getty Images

Marlee Matlin attends the 70th Annual Tony Awards at The Beacon Theatre. Dimitrios Kambouris via Getty Images

Andrew Rannells attends the 70th Annual Tony Awards at The Beacon Theatre. Dimitrios Kambouris via Getty Images

Josh Groban attends the 70th Annual Tony Awards at The Beacon Theatre. Dimitrios Kambouris via Getty Images",2016-06-13 15:00:00
129,She does her nails. ,http://www.essence.com/2016/05/11/youll-never-guess-how-empire-star-likes-unwind,"VALERIE MACON

We were first introduced to Annie Ilonzeh during her days on General Hospital. Today, you can catch her every week on Empire as she stars a persistent journalist, Harper Scott. The Nigerian-American actress who hails from Dallas, Texas is one of 5 girls in her family and notes that she grew up in a frugal home. “We didn’t have the luxury to get our nails done all of the time,” notes Ilonzeh. She’s a tomboy at heart with girl next-door appeal that prefers sweats to evening gowns, and has a serious knack for at-home nail art.

When she’s not on set, writing or living her best fit life at the gym, it’s likely that you’ll find her nestled in the comfort of her home jamming her favorite songs and doing her nails. “I was a manicurist in another life,” she states. “Being pampered is great, but sometimes I like to do those things myself because it’s a little therapeutic and gives me some downtime for myself—and I need that,” she states. Between readings and 14-hour set days, some down time is definitely needed. Ilonzeh’s go-to polish is anything nude, she admits to hoarding nude polish and finding it hard to resist buying a new shade (we hear you, girl!) The perfect finishing touch to her manicure? An accent nail—and we’re not just talking a basic polish change. Ilonzeh goes the distance and experiments with jeweled accents, caviar finishes and marbled art—yea, it’s serious! She’s a beauty minimalist after our own hearts!

A photo posted by annieilonzeh (@annieilonzeh) on Apr 6, 2016 at 2:22pm PDT",2016-06-13 13:22:00
130,"Phoebe is a homeless woman who sleeps by the Friends fountain, who dreams of being a part of the group of friends always having coffee at Central Perk. ",http://uk.businessinsider.com/friends-alternate-ending-2015-8?r=US&IR=T,"Lisa Kudrow as Phoebe in ""Friends."" NBC

For anyone who was a ""Friends"" devotee, it seemed apparent there was something lovably wrong with Lisa Kudrow's character, Phoebe Buffay.

The beautiful blonde never quite seemed all there in the hit NBC sitcom. She referenced having a strange past multiple times on the show, too.

Phoebe told other cast members at various points during the 10 seasons that her mother was a drug dealer, that she hung out with a group of friends behind a dumpster, and that she had been homeless.

One ""Friends"" fan took Phoebe's checkered past and turned it into a dark theory about how the series should have ended, and it has gone viral.

The fan, @strnks on Twitter, posted the theory a few days ago and it has gotten attention on publications like Time and Daily Mail. In @strnks' eyes, the show shouldn't have ended with Ross, Rachel, Monica, and the gang walking out of their apartment, leaving the keys on the counter.

It should have ended just with Phoebe sitting in the friends' favorite haunt, Central Perk, staring out the window. In this alternate ending, Phoebe would have been a meth head, creepily staring out the window at five people who are actually friends — Ross, Rachel, Joey, Chandler, and Monica — and daydreaming up the whole 10 seasons, mentally inserting herself into what she assumes their lives are like.

""All 10 seasons were merely her fevered imagination,"" @strnks writes, ""projecting herself into the lives of the others. All she ever wanted was... Friends.""

Here it is:",2016-06-13 09:11:53
131,The first Spider-Man film. ,http://www.ign.com/articles/2016/06/10/stan-lee-reveals-his-favorite-comic-book-movie,"Legendary comic book writer Stan Lee's favorite comic book movie is the first Spider-Man film.

Loading

""I think my favorite comic book movie was the first one that was such a hit, the first Spider-Man,"" Lee said in reply to a fan on Facebook , going on to add that ""everything else seemed easy"" for the comic book movies that followed once that film was made.Marvel Studios and Sony are rebooting the Spider-Man film franchise with Tom Holland as its web-slinging hero. The first standalone movie, titled Spider-Man: Homecoming , will open in theaters on July 7, 2017 and may star Michael Keaton as the film's villain Which comic book movie is your favorite? Let us know in the comments and for more on the web-slinging hero, check out these 5 Spider-Man comics Homecoming could adapt

Alex Osborn is a freelance writer for IGN. You can follow him on Twitter and subscribe to him on YouTube",2016-06-12 12:54:24
132,"Nicole Scherzinger, Sharon Osbourne, Louis Walsh and Simon Cowell. ",http://www.ok.co.uk/tv/the-x-factor/551508/x-factor-2016-judges-confirmed,"Something went wrong, please try again later.

Get daily celeb exclusives and behind the scenes house tours direct to your inbox

Video Loading Video Unavailable Click to play Tap to play The video will auto-play soon 8 Cancel Play now

THE X Factor 2016 judges have been confirmed.

Following Cheryl, Nick Grimshaw and Rita Ora's departure from the ITV talent show, speculation was rife about who would be joining Simon Cowell on the panel.

(Image: ITV)

And fans will be pleased to hear that a few familiar faces are returning to the show.

Confirming the rumours that Nicole Scherzinger and Sharon Osbourne had signed up for the show again, ITV went on to confirm that Louis Walsh is returning from his hiatus to become the fourth judge on the panel.

(Image: ITV)

Happy to be back on the 12th series of the ITV talent show, Sharon said in a statement: ""I’m overjoyed about going back to The X Factor, sitting with Lou, Lou, gorgeous Nicole and naughty Simon.

""But most of all, I can’t wait to meet baby Eric.”

Nicole, who left the X Factor in 2013 and mentored James Arthur to victory, added: ""I can’t wait to be back in the UK and on the show with the best judges sitting alongside me on the panel.

""I'm excited about discovering, mentoring and winning with an exciting new act this year. And having had winning contestants in the past, Simon knows I will do it.”

(Image: Wenn)

Having chosen to step down from his position in 2015, Louis Walsh explained why he returned.

""He’d say otherwise but I knew Simon missed me last year!

""I’m delighted to be back on the panel especially beside my two favourite female judges Sharon and Nicole, and I’m looking forward to taking them all back to Dublin this year when we head there for auditions.”

Alongside the return of a few familiar faces, the room auditions will be back with filming for the new series kicks off in June.",2016-06-11 16:21:00
133,Pusha T. ,http://www.her.ie/food/youll-never-guess-who-wrote-mcdonalds-im-lovin-it-jingle/296267,"You'll never guess who wrote the McDonald's ""I'm Lovin It"" jingle

No way.

Every so often you'll come across a random fact that completely floors you and this particular revelation is mad altogether.

Advertisement

Apparently, the brains behind that McDonalds jingle, you know the one, I'm Lovin' It, is none other than rapper Pusha T.

Former record company exec Steve Stoute, who now heads up his own marketing business, recently chatted to New York-based radio station, Hot 97, and revealed the inside information.

https://www.youtube.com/watch?v=eBlD2N_AwgI

He said that it was one of the first projects his marketing firm, Translation, looked after.

According to Pitchfork, the information came about when Hot 97's Ebro Darden initially referred to the jingle as the work of Pharrell and Justin Timberlake.

Stoute wasn't long putting him right and apparently said: ""No you know who did that? Pusha T"".

So, JT sang but it was Pusha T who came up with the slogan and the jingle.

Advertisement

YouTube: lundum0",2016-06-11 13:00:00
134,"JD in ""Thelma and Louise."" ",http://www.cinemablend.com/new/Famous-Role-George-Clooney-Hates-He-Lost-Brad-Pitt-135547.html,"Brad Pitt and George Clooney, quietly, have made a ton of great movies together. The real-life friends have collaborated on everything from Coen Brothers comedies to a trilogy of Ocean’s capers. But back in the day, the two reportedly went out for the same roles, with Pitt getting the better on Clooney for at least one specific role that haunts the one-time Batman to this day.

Decades ago – long before he played Tyler Durden or Benjamin Button – Brad Pitt was cast as the handsome thief J.D. in Ridley Scott’s Thelma & Louise. Naturally, Pitt’s looks and charisma helped earn him the part, but as it turns out, he edged future bestie George Clooney for the role. Geena Davis, who played Thelma in Sir Ridley’s classic, recalled that she learned this fact while sitting opposite Clooney on a flight. As she recalls:

At one point, he says to me, ‘I hate that Brad Pitt.’ And I say, ‘No you don’t. He’s your good friend, right?’ And he said, ‘Oh, I hate him because he got the part in Thelma & Louise.’ And I said, ‘Did you want that part?’ And he said, ‘Couldn’t you tell when I read with you?’

Only, according to Geena Davis, she had no recollection of reading with George Clooney for the part! She was so enamored with Brad Pitt – who, to be fair, looks like a god constructed from perfect clay – that she hardly noticed Clooney, and didn’t recall meeting him until that day on the airplane, years later. Davis tells the whole story on The Late Late Show With James Corden, and it’s really worth a listen:

Now, when Thelma & Louise would have been casting (in 1989 or ’90), George Clooney was a TV actor whose “greatest” cinematic credit was playing Matt Stevens in Return of the Killer Tomatoes. He’d appeared on The Facts of Life, and was starting to make a name for himself playing Roseanne Barr’s supervisor, Booker, on the sitcom Roseanne.

But he hadn’t yet become “George Clooney, International Superstar,"" and it probably cost him a significant role. Of course, both Clooney and Pitt ended up doing just fine. But could you imagine Clooney as J.D. in Thelma & Louise? Would the part have worked just as well without Pitt’s outlaw charms?

Clooney isn't the first actor to deeply regret passing on a role. And he won't be the last. But I don't think he regrets it nearly as much as these actors, who ALMOST played superheroes but, for reasons we may never understand, passed on the chance. Some of these still hurt!

Mel Gibson as Odin in the Thor movies? We're not sure that we can actually see that, but according to the Lethal Weapon actor, it almost happened. Gibson admitted this while promoting his latest movie at the Cannes Film Festival, and without even realizing it, he helped himself join an exclusive club of actors who had been offered prominent roles in superhero franchises, only to pass (for various reasons).",2016-06-11 10:46:00
135,In a rap. ,http://hiphollywood.com/2016/05/jay-z-finally-responds-to-beyonces-lemonade-and-youll-never-guess-how-he-did-it/,"Jay Z is finally speaking out about Beyonce’s album, Lemonade.

On the LP, released a month ago, King Bey opens up about she and her hubby’s troubled marriage, specifically, how he was allegedly unfaithful with a “Becky with the good hair.” But up until now, Jay has remained mum.

On Tuesday, Hov, Remmy Ma, Fat Joe and French Montana released a remix for the popular track “All The Way Up and on Jay’s first verse, the New York native gives his thoughts on Lemonade.

“You know you made it when the fact / Your marriage made it is worth millions / Lemonade is a popular drink and it still is / Survival of the littlest,” he raps.

Jay also raps about his 3-year-old daughter Blue Ivy, Prince and Tupac. “Until our babies showered in gold, ni**a / Blue lookin’ like Pac in the tub / David LaChapelle levels of not giving a fuck / Prince left his masters where they safe and sound / We never gon’ let the elevator take us down,” he raps.

The track is available exclusively on Tidal.",2016-06-10 09:59:00
136,She wants kids. ,http://www.sohh.com/youll-never-guess-whats-forcing-khloe-kardashians-lamar-odom-divorce/,"Reality TV star Khloé Kardashian is reportedly back at filing for divorce from estranged husband Lamar Odom and it’s all centered on kids.

According to reports, Khloé’s main reason for wanting the divorce to go through is her intent to start her own family.

Our sources say Khloe sat Lamar down recently and explained she wanted a family, and couldn’t even start the process of looking until she was single again. We’re told Khloe made it clear to Lamar from the time he almost died last year … she was dropping the divorce because she wanted to help him get better. She vowed not to re-file until he was able to run his own life day-to-day, and she believes he’s at that point right now. (TMZ)

Earlier this week, KK shouted out her sister Kim Kardashian and brother-in-law Kanye West‘s two-year wedding anniversary.

In April, Lamar updated fans on his relationship status with Khloé.

“We did talk, you know, everything is [up for] discussion,” Odom said of his ex. “We talk about anything. We’ve been through a lot. It won’t ever stop.” But these days, Odom has more than his personal life on his mind. He told ET that his next step is to “get back on the court.” “I still got it,” he said. (Entertainment Tonight)

Cameras spotted KK with her former hip-hop boyfriend French Montana last month in California.",2016-06-09 14:57:00
137,23. ,http://www.thesun.co.uk/sol/homepage/features/7179863/Youll-never-guess-how-many-midwives-helped-deliver-Prince-George-and-Princess-Charlotte.html,"TONY PARSONS There is no deal to be had with Putin - ultimately, it will be him or us",2016-06-08 14:56:00
138,"Larry Emdur, of course. ",http://www.aww.com.au/latest-news/celebrity/youll-never-guess-which-tv-icon-has-beefed-up-at-51-26933,"Larry Emdur has showed off his beefy new physique in a shirtless selfie that has left fans stunned.

Emdur, 51, dropped 13kg and bulked up to celebrate his 50th birthday, completely transforming his appearance.

Nearly two years later, he is fitter than ever, and still leaving people shocked by how much he has changed from the TV star we all knew and loved.

Emdur says his buff body is the result of careful eating and lots of exercise, inspired by his motivational chest inking.

“The tattoo on my chest says ‘If not now,When?’,” he says. “That motto still gets me up and exercising most days. Feel free to use it, it works!”",2016-06-08 13:54:00
