,summary,link,article,time
36,If he was put in a film with Deadpool. ,http://comicbook.com/2017/03/03/patrick-stewart-professor-xavier-deadpool-return/,"This weekend, the world will bid goodbye to two iconic members of the X-Men Cinematic Universe. Both Hugh Jackman and Patrick Stewart are bowing out of the series after more than a decade on-board. The stars will exit their respective roles as Wolverine and Professor Xavier when Logan hits theaters, and fans are mourning the end of an era. While Jackman had been open about his decision to leave, Stewart's admission had plenty stunned as the actor only confirmed the suspicion last month. However, there is one way the actor could return to his longstanding role.

It's simple; Just put him in a film with Deadpool.

Recently, Patrick Stewart and Hugh Jackman took part in a fan-based interview with MTV. It was there the British actor was asked if he was done with Professor Xavier for good. Here's what Stewart had to say:

""I would have said yes, but the discussion just now about Deadpool makes me think, well, maybe there is a proper justification for the revival of Charles Xavier.""

This isn't the first time Stewart has pitched in support for Ryan Reynold's mouthy mercenary. Last month, the actor said he would love for Professor Xavier to meet Deadpool. ""I would love that. Just set it up,"" Stewart said, even going so far as to ask Jackman to pull enough strings to ensure the meet-up happened.

Hopefully, Professor Xavier won't try too hard to read Deadpool's mind. He may have to scrub his own clean after doing so.

Not long ago, Jackman also confessed he would be interested in playing Wolverine a bit longer under one condition. The actor said he would continue in the role if the grumpy mutant were somehow folded into the Marvel Cinematic Universe. However, given 20th Century Fox's frosty relationship with Marvel Studios, it does not look like the crossover is likely.

""In the near future, a weary Logan cares for an ailing Professor X in a hide out on the Mexican border. But Logan's attempts to hide from the world and his legacy are up-ended when a young mutant arrives, being pursued by dark forces.""

Logan stars Hugh Jackman (Logan), Boyd Holbrook (Donald Pierce), Patrick Stewart (Charles Xavier), Dafne Keen (Laura Kinney/X-23), Doris Morgado (Maria), Stephen Merchant (Caliban), Elizabeth Rodriguez (Gabriela), and Richard E. Grant (Dr. Zander Rice). James Mangold is directing and helped on the screenplay along with Scott Frank and Michael Green.

Logan hits theaters on March 3, 2017. Are you excited for Logan? Rate your anticipation in our Rankings database below!",2017-04-23 08:18:00
37,English Muffins from The Model Bakery. ,http://www.sfgate.com/food/article/Oprah-s-greatest-extravagance-is-from-Napa-and-11078894.php,"When someone with the wealth and popularity of Oprah Winfrey talks about her ""greatest extravagance,"" plenty of things come to mind.

A predilection for seriously expensive vacations, maybe? A love for flipping multi-million dollar homes, à la Ellen DeGeneres, perhaps?

While the talk show host certainly doesn't shy away from luxury trips and pricey real estate, instead Winfrey's greatest extravagance is... apparently available for purchase in St. Helena.

That extravagance? English muffins from The Model Bakery.

""My greatest extravagance is flying in English muffins from Napa Valley,"" Winfrey said in an interview with People Magazine. ""There's a specific English muffin made by these two women at this wonderful bakery in Napa Valley. I know it's not a good carbon footprint to fly in your English muffins but...""

RELATED: Oprah admits she was 'off balance' two years after ending talk show

Winfrey named the English muffins as part of her holiday ""Favorite Things"" list in 2016. In her description of the muffins, Winfrey wrote: ""I don't have to tell you all how much I love bread. These English muffins are my current carb of choice: crunchy on the outside, fluffy on the inside, and scrumptious all over—especially when slathered with the amazing Clif Family preserves that are included. Full disclosure: I took a few bags home from the shoot!""

Model Bakery owner Sarah Mitchell confirmed Winfrey's love for the English muffins, telling the Napa Valley Register last year that she had tried it while in wine country.

""Oprah had the chance to taste our English muffins while visiting the Napa Valley earlier this year, and really loved them,"" Mitchell said. ""We've been sending her special orders for a while and were thrilled when we learned that they would be featured as one of her favorite things for 2016.""

While it may seem strange to declare a baked good an ""extravagance,"" consider the fact that a dozen English muffins and a jar of preserves will set you back $40 on the bakery's online store. The muffins are made of a focaccia dough, all hand-shaped by the bakers, then cooked in skillets using clarified butter. In 2013, Model was noted as making about 1,000 English muffins a day, although we wouldn't be surprised if that number has since increased, due to the Oprah Effect.",2017-04-22 12:03:00
38,Vin Diesel. ,http://www.cinemablend.com/news/1647049/who-came-up-with-the-idea-of-family-in-the-fast-and-furious-movies-according-to-michelle-rodriguez,"While the idea of family in the Fast and Furious franchise has become something of a running joke in online forums, the fact of the matter is that it is impressive to see how this series has never shied away from that central theme. The last seven films have stayed loyal to that core message, and The Fate of the Furious (which debuts in theaters tomorrow) will seemingly double down on it as the franchise moves forward. So who came up with it? Who was the person who figured out that family would make these films pop? According to franchise star Michelle Rodriguez, it can all be traced back to Dominic Toretto himself -- Vin Diesel. Rodriguez said:

It's something that came out of Vin's mouth when he didn't like the line that was there, and I love how it caught wildfire. At the end of the day the movie is all about that. If you've got no heart to keep together all the blowing up and explosions, nobody really cares

So according to Michelle Rodriguez's recent interview with The Los Angeles Times, we can thank Vin Diesel for the heavy emphasis on family that has carried the Fast and Furious franchise through its good and bad times. Throughout all of the monumental changes that have taken place over the course of this series' existence, and above everything else that has transpired over the course of the last sixteen years, one little ad-lib by Diesel established the idea that anchored the Fast and Furious franchise. From 2001's The Fast and the Furious to Paul Walker's final moments on-screen at the end of Furious 7, that's what it has all been about.

We cannot even begin to stress the importance of family when it comes to the success of this film series. Plenty of other big budget blockbusters have attempted the same level of chaos and carnage accomplished by the Fast and Furious movies, and in all honesty, some franchises have outperformed this series in that regard. However, by keeping the series centered on a simple and (most importantly) universal theme like family, the Fast and Furious films have managed to cast an enormous audience net and maintain a sense of intimacy even when things get chaotic and insane during the car chases.

If you are a newcomer to the world of Fast and Furious movies, then you may not ultimately realize how often that topic gets brought up in conversation during these films. For a lesson in the finer points of family, check out a supercut of Fast and Furious ""family"" moments below to see for yourself:

This beloved family of heroes will reunite for their eighth adventure when The Fate of the Furious debuts in theaters tomorrow. If you need to get up to speed before checking out the new film, here's everything we know about the new Fast and Furious movie.",2017-04-22 09:02:00
39,Reggie Wright Jr. and his ex-wife Sharitha. ,http://www.ladbible.com/news/music-suge-knight-reveals-the-name-of-those-behind-tupacs-murder-20170404,"Former CEO of Death Row Records, Suge Knight, is finally ready to announce the name of the man he 'knows' killed Tupac Shakur.

Knight was with Tupac when he was killed in a drive-by shooting in Las Vegas in 1996. Despite the incident happening over 20 years ago the mystery that surrounds his death, as well as a number of bizarre conspiracy theories, has kept people interested in the case.

Credit: PA

Advert 10

However, Knight - who is standing trial for a different murder - has opened up about what he saw that evening. He claims that it was in fact he who was the intended target and that his ex-wife and the former Death Row Records security chief are behind the ordering of the shooting.

Thaddeus Culpepper, Knight's attorney, wrote in an affidavit that his client had known for 'many years that Reggie Wright Jr and his ex-wife, Sharitha, were behind the murder of Tupac and attempted murder of Knight'.

READ MORE:

Advert 10

He also added that Knight has details of Wright's alleged involvement in the murder of Biggie Smalls, the Daily Mail reports.

Knight is speaking out ahead of an upcoming documentary about Tupac's death: Tupac Assassination: Battle for Compton.

Credit: Jmix/JesseSurratt Productions / Youtube



Advert 10

The film's co-director said: ""When our book, came out and we were working on the movie, we gave the salient points of the book (Tupac: 187 The Red Knight) to Thaddeus Culpepper, who read them to Suge Knight.

""Suge's initial response was, 'Who the hell are these guys?'.""",2017-04-21 20:49:00
40,Californication. ,https://www.ultimate-guitar.com/news/general_music_news/anthony_kiedis_the_rhcp_album_cover_that_came_to_john_frusciante_in_his_dream.html,,2017-04-21 17:47:00
41,He killed all the main characters. ,http://comicbook.com/starwars/2017/03/19/rogue-one-writer-cant-believe-what-disney-let-him-get-away-with/,"As the first spinoff film in the Star Wars Universe, Rogue One was expected to take some risks. But the film's writer couldn't believe just what Lucasfilm let the production get away with.

Speaking with our ComicBook.com's Patrick Cavanaugh, writer of Rogue One: A Star Wars Story's Gary Whitta said he always thought the cast of characters in the film would have to die by the movie's end.

""I never believed that they would let us kill off all the characters in the film,"" Whitta said. ""That was our original instinct. The very first meeting with Gareth I remember saying, 'I kind of feel like they all need to die, but there's no way Lucas ... There's no way Disney'll let us do that. We can't kill everybody. It's a Disney movie.' And yet, they were fully supportive of it, and it's actually one of the coolest things about the film.""

Rogue One chronicles the journey of a ragtag group of Rebels who band together in an effort of recovering the Death Star's plans, in which there's one crucial flaw to be exploited planted within by the superweapon's creator.

The crew ultimately sacrifices their own lives so that the plans can get into the hands of Princess Leia and her cohorts, leading directly into the first Star Wars film released 40 years ago.

UP NEXT: Why Fans Will Never See Its Opening Crawl

""It's one of the thing that I hear the most is that last 20 minutes when you've got all these characters are basically going to make the ultimate sacrifice,"" Whitta said. ""It's the biggest kind of emotional punch that I think the movie has. I'm so glad that they supported that decision.""

Whitta elaborated that there was an enormous pressure from day one—not from Lucasfilm or Disney, but from himself. He said that he and Gareth Evans were determined not to be responsible for being the ones who ""screwed up Star Wars.""

""It took us awhile to get to grips with what it really meant to do a standalone film, but then once we understood it, we realized that it's actually really liberating,"" Whitta said. ""These characters are kind of one and done characters. There was never going to be a Rogue Two. Rogue Two already exists. That's what the original Star Wars is, and those characters aren't in it apart from Leia and Vader, and so we knew that we, now didn't necessarily mean that we had to, but it meant we had the luxury to, you know, we had the full spectrum of options in terms of what the fate of these characters were.""

He added that their deaths wasn't in the first draft of the story because they didn't think Lucasfilm or Disney would allow it, possibly leaving main character Jyn Erso on the table to appear in a future film.

""We always felt that it was the right thing to do, that these characters make the ultimate sacrifice,"" Whitta said. ""It wasn't that way in my original script, but again, we never felt that we would get away with it. K-2 always died, but Jyn survived in the very first version of the movie that we developed, and then it was Gareth who kept pushing for it, saying, 'I feel like they need to die. They need to die.' Eventually he convinced [Disney and Lucasfilm].""

Ultimately, the film benefitted from having a sense of finality in the greater, ongoing Star Wars saga.

""We kind of went back to that original idea of these characters, you know, it was kind of okay that they died, because they completed the mission,"" Whitta said. ""They die so that the whole Star Wars franchise can live, basically.""

Rogue One: A Star Wars Story hits digital HD on March 24. The film will then be released on Blu-ray and DVD April 4.

MORE ROGUE ONE NEWS: ·Why Carrie Fisher Was Taken Back By Leia's Cameo

·Darth Vader's Epic Scene Nearly Didn't Happen

·Why Blu-Ray Won't Feature Deleted Scenes

·How And Why He Rogue One's Ending Changed

Directed by Gareth Edwards, it's the first of the new standalone features from Lucasfilm and Disney, which take place outside the core ""Skywalker Saga"" of films noted by an Episode number. Rogue One tells the story of the small band of rebels that were tasked with stealing the plans to the first Death Star.",2017-04-21 14:46:00
42,"...but not to us, because they ""can't legally show [us] the concept art just yet."" ",http://comicbook.com/marvel/2017/04/18/marvel-unveils-first-look-at-brie-larson-as-captain-marvel/,"Marvel Studios invited select members of the press to tour their offices on the Disney lots in Burbank, California on Monday afternoon.

During the tour, several new looks at films and characters coming up in the Marvel Cinematic Universe were unveiled, including Taika Waititi's portrayal of Korg in Thor: Ragnarok, but none were more exciting than the first female hero who will get her own film.

On display in one of Marvel Studios' offices was a trio of concept art photos showcasing Larson in costume as Captain Marvel.

The costume was pulled straight from the pages of Marvel Comics. The most notable difference is the downplaying of the yellow which grabs the eye of those looking at Carol Danver's constume. Instead, it is a much lighter yellow, which can appear to be white at a glance. Otherwise, the suit on the cover of Kelly Sue Deconnick's Captain Marvel #1 is a quite accurate representation of what fans can expect to see in live action.

Artist Andy Park did point out that the costume is still evolving and Larson has not yet tried on the design featured in the concept art images.

Beneath the pair of images which simply showed Larson in costume as Captain Marvel was a design of the character fighting a handful of mech-type enemies in city streets. The enemies had purple eyes, one pair of which were shooting lasers in the background, but Captain Marvel used only one hand to keep the immediate threat's attempted punch away from her -- and was making it look easy.

As for whether or not those images will be released online any time soon, it doesn't sound like it. Larson will make her debut as Captain Marvel in Avengers: Infinity War which is deep into production but Marvel Studios is looking to keep the focus on the four remaining films prior to the ensemble: Guardians of the Galaxy Vol. 2, Spider-Man: Homecoming, Thor: Ragnarok, and Black Panther.

MORE MARVEL NEWS: First Black Panther Footage Revealed / Iconic Planet Hulk Characters Confirmed For Thor: Ragnarok / Kevin Feige Comments On Josh Brolin's Thanos & Cable Roles / Spider-Man: Homecoming's Ultron & Civil War Ties Revealed / Marvel Unveils First Look At Brie Larson As Captain Marvel

Captain Marvel hits theaters March 3, 2019.",2017-04-19 12:56:00
43,He didn't. ,http://www.nova100.com.au/entertainment/youll-never-guess-how-daniel-radcliffe-spent-his-harry-potter-dollars-0,Like this song Dislike this song,2017-04-19 11:32:11
44,"Want to join the fight against clickbait? We're seeking to add volunteer editors to this page. If you're interested in joining us, simply fill out this form: https://goo.gl/forms/QMOrdqKipdA13zgt2

Thanks!",https://goo.gl/forms/QMOrdqKipdA13zgt2,"Thanks for taking the time to fill out this form!

We'll get back to you soon.",2017-04-15 06:30:55
45,Nah. (Photo in comments) ,https://www.someecards.com/entertainment/celebrities/ariana-grande-instagram-ponytail/,"Seeing Ariana Grande without her signature ponytail is extremely rare. They go together, much like peanut butter and jelly. But is it possible that Ariana Grande may be leaving her ponytail behind?

In a shocking move, Ariana posted a rare selfie to Instagram on Wednesday where she was wearing her hair DOWN! (I know, I know. Change is hard. We'll be okay.)

You're probably thinking that was just a fluke, right? Ariana Grande can't possibly forgo her signature ponytail for more than a day, right? WRONG. The pop star posted yet another photo with her hair down on Thursday afternoon.",2017-04-11 08:32:30
46,Mel B is mad that Beckham sang Spice Girls songs because she shunned the group's reunion. ,https://www.someecards.com/entertainment/celebrities/mel-b-victoria-beckham-spice-girls-carpool-karaoke-scary-spice-posh-spice/?utm_source=2017-03-03&utm_medium=email&utm_campaign=newsletter,"On Thursday night, Victoria Beckham, who was once the Spice Girls' Posh Spice, appeared with James Corden in his Late Late Show's Carpool Karaoke segment. Only it wasn't the normal style Carpool Karaoke—instead it was a trailer for a totally fake reboot of the 1987 movie Mannequin.

Nevertheless, according to The Sun, Spice Girl Mel B. (a.k.a. Scary Spice), is ""livid"" that Victoria Beckham performed Spice Girls songs in the brief Carpool Karaoke clip, especially because Beckham shunned the band's recent reunion. Mel B. is also apparently peeved that Beckham is using Spice Girls songs in the campaign for her Target collaboration.",2017-04-04 10:37:51
47,Soy sauce. ,http://www.bravotv.com/blogs/top-chef-brooke-williamson-shirley-chung-favorite-condiment-soy-sauce?cid=soc_dg_fb_Feast,"It's why Shirley says she could never do the Whole30 diet.

Create a free profile to get unlimited access to exclusive videos, sweepstakes, and more!

Top Chef's Shirley Chung and Brooke Williamson Reveal What They Eat When They're at Home

The life of a Top Chef alum seems like it's a nonstop food-fest all day, every day—cooking and tasting the best of the best, traveling the world, and getting wined and dined everywhere you go. We can imagine all that excess takes its toll. So when Top Chef Season 14 winner Brooke Williamson eats at home, she tries to stay healthy.

""I don't eat a lot of dairy, I don't eat a lot of processed food,"" the Los Angeles-based chef said, explaining that she travels a lot—and when she travels, she indulges herself. ""So when I go home, I feel like that's my time to kind of collect myself and clean out,"" she explained.

In fact Brooke, who owns four restaurants in LA along with a store selling culinary goods, recently completed the trendy Whole30 diet and gave up drinking alcohol for a month. ""And I felt great! So I kind of wanted to continue it,"" she said, adding with an eye-roll: ""And then I came to New York.""

Can you see the resemblance? #sisters A post shared by Brooke Williamson (@chefbrookew) on Sep 4, 2016 at 1:53pm PDT

Top Chef Season 14 first runner-up Shirley Chung also likes to stay healthy when she's not traveling or working. ""I cook a lot of Italian and Chinese food at home, so it's always balanced with lots of vegetables, a little bit of protein, and some starch. Naturally, I don't eat a lot of dairy…and I love vegetables,"" she said.

Shirley is hard at work on her new restaurant, a casual spot called Steamers Co., which she plans to open in downtown LA. She's partnered up with her husband (who will be working the front of the house) to serve up simple, healthy bowls of steamed seafood.

Keeping it healthy at home, however, isn't always easy. Shirley said she tries to avoid carbs, but ""I cannot stay away from rice, noodles, or soy sauce,"" she declared. ""So there's no way I could do [Brooke's] Whole30.""

The Whole30 program bans ingredients like sugar, grains, dairy, and legumes—including all forms of soy. Meat, seafood, veggies, some fruit, and good fats are allowed.

""What I missed the most?"" Brooke couldn't help but chime in. ""Bourbon and soy sauce! I wanted a bourbon and a bowl of rice with soy sauce. That's what I missed the most.""",2017-03-20 21:15:54
48,Khloe. ,https://www.teenvogue.com/story/kylie-jenner-steals-clothes-from-this-sisters-closet?mbid=social_facebook,"There's no question that one of the major perks of being part of the Kardashian-Jenner family is the decked out closets. More specifically, borrowing from those of your very stylish sisters. Kylie has been called out by everyone from Kim to Kris for going into their closets without permission and snagging a little something for herself, but when it's family, it's just borrowing... I mean, right? (We'll go ahead and assume Kylie returns everything eventually.)

The latest hand-me-down that the youngest Jenner sister has gotten her hands on is a killer pair of over-the-knee boots that originated in Khloe's extremely organized closet. Kylie shared the leopard-print stilettos on Instagram, captioning it, ""to have older sisters who love to share is a blessing,"" so we're guessing Khloe already knew this particular pair of statement shoes had gone missing. See? At least she's asking first.

Instagram content This content can also be viewed on the site it originates from.

Yes, Khloe (and to the rest of the family, for that matter...), we would love to also be invited to share any goodies you no longer feel like you need to keep around for yourself. And with your amazing new fashion line, we can see exactly why Kylie chose to raid your closet.

Related: Kim Kardashian Just Copied Kylie Jenner in a MAJOR Way

Check this out:",2017-02-23 14:46:19
49,Blue. Photo in comments. ,http://www.mtv.com/news/2967652/bella-thorne-dyed-hair-blue/?xrs=_s.fb_main,"Mike Pont/WireImage

Bella Thorne Ditches Her Red Hair For Something Much More Dramatic

Bella Thorne is trying something different from her trademark fiery red hair. On Wednesday (December 28), she shared a video of herself with her tresses dyed a deep navy ombré — a pitch-black color that bleeds into midnight blue.

The Disney Channel alum revealed her new 'do on Snapchat, where she snapped every step of the dyeing process. This included her jamming out to Lil Aaron and Futuristic while waiting for the dye to set. She shares so much of her life with fans that it's no surprise she documented the whole experience on social media.

Before this, Thorne rocked neon red and yellow hair with her older sister, Dani. Then they both dyed the tips of their hair rainbow two weeks ago. Now Bella's gone blue (da ba dee da ba die).

Bella Thorne/Snapchat

Does this mean Dani will follow her baby sister's footsteps? She hasn't posted any blue hair pics yet, but judging from this Instagram tease, the answer might be yes.

Turns out the Thorne sisters slay the twinning game.",2017-01-05 10:15:48
