,summary,link,article,time
0,"Gadot is Israeli, and pronounces her last name ""Guh-DOTT."" ",http://www.slate.com/blogs/browbeat/2017/05/30/how_to_pronounce_gal_gadot_the_star_of_wonder_woman.html?utm_content=inf_74_2641_2&wpsrc=socialedge&tse_id=INF_4a5c0850495611e780b645b806a7020f,"With the release of Wonder Woman, star Gal Gadot finally gets a spotlight all to herself. The Israeli actress has appeared in some of the biggest movies of the last several years, including four entries in the Fast and the Furious franchise and Batman v Superman: Dawn of Justice. She’ll also reprise the role of Diana Prince/Wonder Woman in the DC Extended Universe’s Justice League, which is due out later this year. But if Gadot’s face is nigh inescapable, she’s not yet a household name—and even people who do know her name usually say it wrong.

Advertisement

Perhaps it’s the similarity to the absent title figure of Samuel Beckett’s most famous play, but the go-to pronunciation for Gadot’s surname tends to treat it as if it’s French: Guh-DOH. But as mentioned above, Gadot is not French: She’s Israeli, and she pronounces her name, quiet sensibly, in the Israeli fashion, which is to say with a hard T and a short O: Guh-DOTT. Here’s Jimmy Kimmel, making a good effort but not quite getting it right.



Advertisement

Advertisement

Advertisement

Advertisement

Advertisement

But why subject yourself to the imprecision of phonetic spellings when you can learn from the woman herself? Here’s Gal Gadot saying “Gal Gadot,” followed by a long string of people following her lead.

One last tip. The correct pronunciation of “I am upset that a movie that is opening on well over 2,000 screens will have a tiny number of individual showings whose audience is voluntarily limited to women” is “Boo-HOO.”",2017-06-04 14:41:29
1,Ghost. ,http://www.mirror.co.uk/tv/tv-news/games-thrones-fans-share-sympathy-10485347,"Season 7 of Game of Thrones is teased in new trailer

Season 7 of Game of Thrones is teased in new trailer

The four-legged star behind Jon Snow's faithful companion passed away this week at the Wild Spirit Wolf Sanctuary

Game Of Thrones author George R.R. Martin has made the sad announcement today that the real-life wolf who played Ghost is dead.

Jon Snow's faithful companion was played by an albino Arctic Wolf and lived at the Wild Spirit Wolf Sanctuary in Nex Mexico, USA.

The four-legged star of HBO's fantasy drama, who passed away this week, was part of a pack that lived at the rescue centre supported by the Martin family.

Breaking the news on Twitter, Martin said: ""In loving memory of the real life Ghost from the Wild Spirit Wolf Sanctuary. He passed this week & he will be missed. R.I.P""

Image: HBO) HBO)

Fans of the show took to Twitter to give their sympathies and hope that the direwolf won't be killed off in the books or the show.

Ghost is one of the only two remaining Stark direwolves in Game Of Thrones, but Nymeria has been missing since the first season.

The runt of the litter, who was gifted to illegitimate Stark Jon Snow, quickly became popular amongst fans during his time at the Wall.

James Cosmo accidentally 'gives away' BIG Game of Thrones spoiler on Sunday Brunch

Image: HBO) HBO) Image: HBO) HBO)

Video Loading Video Unavailable Click to play Tap to play The video will auto-play soon 8 Cancel Play now

Ghost was clearly distinguishable from the other family pets due to his albino fur and striking red eyes.

Game Of Thrones fans have had to deal with the tragic deaths of four direwolves on the show, but hope Ghost could possibly sit at his master's side by the Iron Throne.

In season 1, Northern Inuit Dogs played the young puppies, with Sophie Turner adopting the dog who played Lady.

Image: Reuters) Reuters)

Game Of Thrones viewer took to Twitter to give their sympathies for the real-life ghost.

One fan said: ""Aww thats so sad RIP beautiful creature!""

Another added: ""Losing a friend is never easy. May he be not only missed but also remembered.""

A third said: ""A great man once said...'The lone wolf dies but the pack survives""

Video Loading Video Unavailable Click to play Tap to play The video will auto-play soon 8 Cancel Play now

Image: HBO) HBO)

Meanwhile, fans of the show have found out that they won't have to wait too long for its return.

The release date for season 7 has finally been announced in a brand new teaser

Fans of the hit HBO series have been forced to wait over a year for their next fix of Westeros, but the wait will soon be over.

The next series will premiere on July 16th, where viewers will see the battle for the Seven Kingdoms get into full swing as Daenerys Targaryen sails across from Essos to face Queen Cersei.

Image: HBO) HBO) Image: HBO) HBO)

However, the teaser shows the danger about to come down from the north, as the camera pans slowly moves out from the evil blue eye of the Night King to reveal his dark face.

The official Game Of Thrones twitter account tweeted: "" #GoTS7 begins 7.16 on @HBO . #GameofThrones

While the battle for the Iron Throne wages on in the south, the threat everyone should really be focusing on is the White Walkers.

Fans couldn't contain their excitement over the new teaser, but were slightly disappointed that another full trailer has not been released

Just three weeks after the first trailer dropped, new snaps were released showing Queen Cersei sitting regally on the Iron Throne with her brother-slash-lover Jaime Lannister standing beside her with his impressive sword on display.

Cersei - who spent the last season behind stripped naked and humiliated as punishment for her infidelity - wears a simple metal crown and chain mail armour, suggesting she'll be doing battle to cement her status as royalty in the upcoming series.

Image: HBO) HBO) Image: Sky Atlantic) Sky Atlantic)

Other pictures show Lyanna Mormont, who up until Season 6 was a little-known character until she proclaimed her house for Jon Stark, declaring him the King of the North.

The upcoming series also catches up with Gilly and Samwell Tarly, who can be seen studying some books in a dark room. Gilly is reading, suggesting Samwell has achieved his goal of educating her since they fled from her abusive husband.

Daenerys Targaryen is back, looking serious as she surveys a scene in front of her. She wears a dragon badge on her outfit, but there are no signs of her three dragon 'offspring'.

Tyrion - by now Daenerys' Hand, or chief advisor - is in place beside her, alongside Varys 'the Spider', Grey Worm and Missandei.

As last month's trailer showed, the battle to rule the seven kingdoms has been absolutely ruthless so far, and that's not about to change.",2017-05-24 16:34:33
2,"""...I always thought I was the most outsider, weird person in the movie, and, 'Why was I cast in it?' and I had no voice."" ",http://www.cinemablend.com/news/1653270/why-diane-keaton-hasnt-watched-the-godfather-in-30-years,"While Diane Keaton might not be the first name that comes to mind when you think about The Godfather, her performance as Michael Corleone's long suffering wife Kaye Adams is still a fine and memorable turn in the classic movie. It turns out that Diane Keaton herself has actually been disregarding her work in The Godfather, too. The legendary actress has now admitted that, until recently, she hadn't watched The Godfather in around 30 years because she always saw herself as the outsider in the film. Diane Keaton admitted,

I was so shocked because I never did pay that much attention to The Godfather because I always thought I was the most outsider, weird person in the movie, and, 'Why was I cast in it?' and I had no voice. But then I had a couple of good scenes with Al.

Of course, Diane Keaton isn't wrong with her assumption, because Kay Adams-Corleone is one of the few non-Italian characters in both The Godfather and The Godfather Part II. In fact, Kay Adams is constantly kept at arms length regarding the family business throughout the films, and as things escalate throughout the second movie, the audience even sees her become a prisoner in her own home. Still, The Godfather is a movie that's on cable fairly often, and you'd have at least expected Diane Keaton to have a quick peek at her performance at some point over the last thirty years, especially since she's in the iconic final shot of the first film.

Diane Keaton admitted at the Tribeca Film Festival that she finally sat herself down to re-watch The Godfather for the first time in three decades recently. As you'd expect the actress was blown away by just how engrossing and gripping the gangster epic was, especially because she still found herself overwhelmed by the film even though she was watching it on a computer. Diane Keaton recalled,

I saw it on my computer. I hadn't seen it for I think about 30 years. And I looked at 1, and I just remember all the people, I couldn't handle it, it was so astonishing, it was so beautiful, and everybody is so great in it, and the music, and every choice [Francis Ford Coppola] made. And that damn Talia -- I saw you in that scene with all the fighting. And then you had slow, long scenes. Everything was astonishing to me. And I was totally surprised because I didn't expect it. And on a fucking computer.

Diane Keaton made the above revelations during the emotional reunion of The Godfather's cast and crew at the closing night of The Tribeca Film Festival on Saturday night, which came after the first two films were screened back to back over an absorbing 7 and a half hour period. As well as Diane Keaton, Al Pacino, James Caan, Robert De Niro, Robert Duvall, Talia Shire and co-writer and director Francis Ford Coppola took part in the wide-ranging discussion, which was hosted by director Taylor Hackford and was supposed to last 45 minutes but actually went on for an hour and twenty. I will forever be thanking my lucky stars that I was in attendance at the once in a life-time event, and stay glued to CinemaBlend over the next few days for further stories and revelations from the panel.

In addition, Paramount will release all three films in the epic Godfather crime saga on Blu-ray, DVD and Digital HD on Tuesday, May 9.",2017-05-13 11:00:00
3,"She's allowing people to visit her guesthouse, ""The Lodge"", on certain days, at certain times. ",http://ctrylv.co/66pB7xu,"Ree Drummond superfans have no shortage of places to get their Pioneer Woman fix. There's her blog, her regular Food Network show, her more than a dozen books, and soon, her magazine. The fanfare's been enough to turn her town of Pawhuska, OK, into a legit tourist destination, especially since Drummond opened The Mercantile, a general store-meets-bakery-meets-deli last fall. And this June, folks have even more reason to go.

This content is imported from Instagram. You may be able to find the same content in another format, or you may be able to find more information, at their web site.

For 15 days over the course of the month, Drummond is allowing people to visit The Lodge. It's her family's guest house, and also where she films most episodes of The Pioneer Woman. A post on The Mercantile's website shares, ""There's plenty to do (and eat) both inside The Merc and around Osage County, and we'd love to have you in our neck of the woods. Bring your sweetie, bring your mom, bring your cousins, bring a group of old friends. We want you to enjoy the heck out of The Merc and Pawhuska!""

The Lodge will be open from 9am - 4pm on the selected dates. The best part? It's totally free to visit!

This content is imported from Instagram. You may be able to find the same content in another format, or you may be able to find more information, at their web site.

You'd be wise to take her up on her offer: Before she became the star she is today, Drummond would host fellow bloggers at her ranch, but the land has since become more of a private haven for just family and friends. There's no charge to see the space, and no limit on how many people can go. So strap on those cowgirl boots, and get to planning your summer trip.

Sarah Weinberg Deputy Editor Sarah Weinberg is the deputy editor at Delish and has covered food, travel, home, and lifestyle for a number of publications, including Food Network Magazine and Country Living.

This content is created and maintained by a third party, and imported onto this page to help users provide their email addresses. You may be able to find more information about this and similar content at piano.io",2017-05-12 13:56:00
4,He was traded to Nashville to be closer to his wife. ,http://faithtap.com/7882/hockey-heartthrob-mike-fisher-shares-story-about-family/?utm_source=jclu&utm_medium=Facebook&utm_campaign=main&src=jclu,"“She’s putting her energy into something else so that’s helping her, knowing that she is helping others who are going through the same thing.”",2017-05-03 08:08:54
5,Actors Brandon Flinn (Justin Foley) and Miles Heizer (Alex Standall). ,http://www.mtv.co.uk/13-reasons-why/news/youll-never-guess-which-two-13-reasons-why-actors-are-dating-irl,"If, like us, you spent all weekend indoors watching 13 Reasons Why, then prepare to be thrilled because we have some really great news for you.

It turns out that two of the actors in the series are actually dating in real life, and honestly we’ve never been more immediately obsessed with a couple more in our entire lives.

https://instagram.com/p/BL20SbDhxYf

Yep, Justin Foley and Alex Standall, aka Brandon Flynn and Miles Heizer, are totally a thing and Twitter is understandably freaking out with joy.

https://twitter.com/lindseyariannax/status/848781462077820929

https://twitter.com/preponstan/status/848736984990310400

https://twitter.com/owtroye/status/848445281469386752

ICONIC. We couldn’t have put it better ourselves.

Now get back to watching 13RW if you’ve not already finished, we have SO much to catch up on gang.

Watch! 13 Reasons Why stars Katherine Langford and Dylan Minnette reveal what they love about each other:",2017-05-01 05:27:52
6,"She made the hospital play ""Fantasy"" while she gave birth. ",https://thefabgab.co/blogs/nick-cannon-says-this-is-the-most-diva-thing-mariah-carey-has-ever-done?utm_campaign=106683&utm_medium=cmsshare&utm_source=facebook&utm_term=nene_leakes,,2017-04-30 13:13:21
7,Seth Rogan (Pumbaa) and Billy Eichner (Timone). ,http://trib.al/OUXHCrk,"Disney has cast the roles of Timone and Pumbaa in the live-action ""The Lion King,"" and we didn't see this duo coming

Disney is slowly collecting a nice slew of voice talent for their upcoming live-action Lion King. First, there was Donald Glover playing Simba, along with James Earl Jones returning as the voice the wise Mufasa. The studio is pretty keen on snagging Queen B to play Queen of the Jungle, Nala. And now, they’ve announced who’s taking on the roles of jungle best-friends forever and ever:

Timone and Pumbaa will be played by – drumroll, please — Seth Rogen and Billy Eichner.

Since it’s April 25th, this is too late to be an April Fool’s joke, so this is really happening. James Franco’s bestie and that guy from the street are really going to croon “Hakuna Matata,” and also the opening few bars of “Can You Feel The Love Tonight.”

FotorCreated4.jpg Credit: Jason LaVeris / Contributor / Getty Images, Emma McIntyre / Contributor / Getty Images

The Wrap first broke the news, and this is BIG NEWS. According to The Wrap, Rogen will voice Pumbaa, and Eichner will lend his sweet, sweet voice to Timon. The two will take over the roles from Ernie Sabella and Nathan Lane, respectively, who played the warthog and meerkat duo in the OG animated version..

Neither Rogen nor Eichner has Tweeted/Instagram’ed/commented on this casting yet, so we excitedly await their grand announcement. And, also just how they’ll tackle these iconic roles, along with how they’ll get into character.

There are still a lot of important roles left to be cast for this movie, like SCAR, along with Rafiki, Zazu, and the hyenas. However, there’s still plenty of time left to find them, as the movie doesn’t open for two more years:",2017-04-30 09:57:00
8,"He changed it to just ""Cyrus"". #StopClickbait",http://trib.al/apDCkb9,"Iconic country singer Billy Ray Cyrus first stole our hearts with his classic hit, “Achy Breaky Heart.” But now, Billy Ray Cyrus announced that he’s in the process of changing his name. While this might sound strange, the change has actually been a long time coming. The Hannah Montana alum apparently wanted to go by this name since before he was famous. Now that we know that, this move actually makes a ton of sense. So what is Billy Ray’s long awaited new name?",2017-04-30 08:23:57
9,The Walking Dead has become more about gore than storytelling. ,http://mondaymondaynetwork.com/entertainment/fans-leaving-show-season-walking-dead/,"HAS THE WALKING DEAD KILLED THEIR FANS?

According to The Verge, and several Twitter fans of The Walking Dead, many die-hards are leaving the show this season after the opening episode of Season 7 where we lost Glenn and Abraham. They’re also leaving in troves as the ratings have dropped to an all time low since Season 3.

Rest assured: these numbers DO predict the future of the shows that run on TV. With the recent backlash of gore, Walking Dead even had to cut back the blood in Fat Joey’s death.

They are listening to the fans, but some have gone completely rogue and are boycotting the show at every turn.

The main reason people are leaving isn’t just because two leads were killed, where only one was expected to die. If that were the case, there wouldn’t be anyone left to watch Game of Thrones, where leads die off in packs.

Game of Thrones | Photo Credit HBO

The reason people are leaving is that they feel the creators are more about the shock value of the show than the story. Essentially, the series has gotten to a point where it’s more into manipulating its audience than being faithful.

Obviously, this is somewhat of a double-edged sword. While it can’t be denied, why would fans want everything exactly like the comic series? Have we not developed a degree of trust in a show so powerful? Is it possible that these thoughts are just from fair-weather fans?

Blaming Showrunner Scott Gimple

Some fans blame new showrunner, Scott Gimble, saying he took an emotionally charged show that involved zombie deaths and character growth and turned it into torture porn, rather than a network drama.

The evidence for this idea started in Season 6 when we went down the rabbit hole as the gang was trying to escape. Again, this can be argued both ways. Were we manipulated or were we given a chance to feel scared for our heroes?

Other points of manipulation include Glenn’s dumpster death (which even involved removing his name from the credits). They leaked bashed-in-head photos online. And yes, they filmed everyone to avoid actual leaks, but this seems no different than Christopher Nolan keeping his work private. They kept Negan’s identity secret. But again, this is somewhat of a stretch and is more about storytelling. Consider the opening of The Departed where we don’t see Nicholson’s face, but merely a silhouette for the first few scenes to add drama.

Negan in The Walking Dead | Photo Credit ComicBook.com

Will Negan Make Rick Stronger?

Whatever your opinion, this all lead up to the premiere where Glenn and Abraham were killed by the hands of Negan in a horrific manner involving Lucille, Negan’s trustworthy baseball bat.

Later, when Negan was attempting to force Rick to cut off his son’s arm, some refer to this as cruel and violent, as well as cheap tension. Again, this feels like something necessary to change Carl and Rick’s relationship within the story. To a degree, whatever Negan does will make Rick stronger.

While it would appear to be best to defend the series, those who are leaving seem to have their minds set. They feel that the show has left its roots of character development, which could tie in with the fact that we already know King Ezekiel’s background, something that may have been kept secret longer before.

Whatever these quitters feel about this new fork in the road, one can’t help but think of a favorite team’s losing season after a big win. Fewer jerseys line the store windows, and ticket prices are lower, but maybe it’s because the fans just haven’t screamed loud enough.

We’ll find out soon enough.

Sponsored Links",2017-04-29 17:40:00
10,"He played it. The song was ""You Can Never Tell"" by the late Chuck Berry. ",http://en.newsner.com/crowd-asks-springsteen-to-play-another-singer-s-song-his-response-leaves-them-speechless/about/music,"These days, performers usually prepare every detail of their concerts ahead of time. Especially when they are world-class artists like Bruce Springsteen.

But if you’re accomplished as much as Springsteen has, you can pretty much do whatever you want.

So when Bruce saw a sign in the audience during a concert in Leipzig, Germany asking him to play “You Can Never Tell” from the cult movie “Pulp Fiction,” he handled it, well, like a boss.

Bruce started by trying a couple of different keys and consulting with his band. In front of a crowd of 45,000, “The Boss” was straining. Not even the band could hide their surprise, and I can’t even imagine how the promoters and organizers were feeling.

Then a few seconds later, Bruce and the band gave it a shot—and I need hardly mention that the performance was a smashing success.

Share if you also think Bruce Springsteen is “The Boss”!

Published by Newsner, please like",2017-04-29 11:39:00
11,"The lyric ""Only shootin' stars break the mold"" was originally ""Wave bye bye to your soul"" ",http://www.spin.com/2017/02/original-handwritten-lyrics-show-smash-mouths-all-star-was-almost-a-much-darker-song/?utm_source=facebook&utm_medium=social&utm_campaign=timeline,"Smash Mouth’s “All Star” is a motivational speech wrapped in a pop song. “Hey now! You’re a rock star, get the show on, get paid,” and so on. There doesn’t seem to be much ambiguity in its message: being an all star is cool, being a rock star is cool, getting paid is definitely cool, and hey, you never know–if you give yourself a shot and aim for the skies, you might break the mold and become an all star, too. Cool!

But according to an original draft of the lyrics, penned by original Smash Mouth guitarist Greg Camp and tweeted out from the band’s account this afternoon, there might be a darker side to living out your dreams of riches and celebrity.

At the end of the chorus, there’s a line crossed out, with the lyric that made the final cut–“And only shooting stars [will] break the mold”–shoved into the margin. Look closely, and you can read the original draft underneath the scribbles: “Wave bye bye to your soul.”

That single line puts a darkly ironic twist on a song that otherwise seems pretty naive: sure, you can live only for fun, hit the ground running, take the backstreets, and set your world on fire–you’ll shine, you’ll glow, but you might lose the very thing that makes you human in the process. Being a rock star is fun and all, but sooner or later, you end up alone on the tour bus, surrounded by empty bottles, staring into a tiny handheld mirror, wondering where your high school sweetheart is and what things would have been like if you’d taken a different path. (Or maybe I’m just projecting.)

Look at the top of the lyrics sheet (which the band has tweeted out at least once before), and you’ll also notice a subtle perspective shift in the first verse. “All Star” originally opened not with an unnamed somebody looking kind of dumb with her finger and her thumb in the shape of an “L” on her forehead, but with the song’s narrator, Mr. All Star himself, as the dumb one. What does it all mean?

With the “bye bye to your soul” thing in mind, all sorts of other hidden depths of “All Star” start to reveal themselves. There’s that glancing reference to climate change in the second verse, for one thing. And isn’t the assertion in the chorus that all that glitters is in fact gold just a little to peppy and on-the-nose to be taken at face value? The darkness and mystery implied in “All Star” inspired one incredibly devoted Smash Mouth fan to compile a Reddit post two years ago, explaining in detail why “Smash Mouth’s song “All Star” is about the exact opposite everyone thinks it is.”

We may never know the band’s reason for cutting the “soul” line and replacing it with much more saccharine lyrics about shooting stars. But if “All Star” really is about the ultimate hollowness of contemporary life, I guess there’s a lot more going on in the opening sequence of Shrek than we gave it credit for, too.",2017-04-28 17:29:00
