,summary,link,article,time
83,"Weather.
#winterisnotcoming
",http://elitedaily.com/entertainment/game-of-thrones-season-7-weather-delay/1545063/,"I really thought this short week of work was going to be easier than most, but after learning season seven of ""Game of Thrones"" will be delayed, well, I'm just not so sure anymore.

According to reports, the rest of your summer is now ruined due to the fact ""GoT"" has to delay the filming of season seven as a result of... wait for it... the WEATHER.

Though the HBO hit has traditionally debuted each new season in April, showrunners David Benioff and Dan Weiss have reportedly revealed we'll have to wait for a later start date in 2017.

Speaking on the ""UFC Unfiltered"" podcast, the minds behind the television adaptation of George RR Martin's novels said,

We don't have an air date yet, but this year will probably be a little bit later.

They continued,

We're starting a bit later because at the end of this season, 'Winter is here' -- and that means that sunny weather doesn't really serve our purposes any more. So we kind of pushed everything down the line, so we could get some grim grey weather even in the sunnier places that we shoot.

Ned Stark was right all along, and now Westeros' winter has ruined our summer. I can't even.

Citations: Game of Thrones season 7 air date is pushed back, but there's a very good reason (Digital Spy)",2016-07-18 08:25:09
84,"""Why am I famous? That's up for question too...""
",https://extratv.com/2016/07/12/watch-little-boy-ask-kim-kardashian-why-are-you-famous-see-her-response/,"Watch Little Boy Ask Kim Kardashian, ‘Why Are You Famous?’ — See Her Response!

Getty

On Monday, Kim Kardashian took to Snapchat to share a video of herself being grilled by a little boy named Sid, who asked her about fame.

When Sid asked Kim if she was famous, she responded, ""I don't like to use that term.” Watch!

Waiting for your permission to load the Instagram Media.

Sid followed up by asking Kim, “How are you famous?” Kim kept her answer at PG as possible, telling him, ""How am I famous? That's up for question, too.”

Waiting for your permission to load the Instagram Media.

Sid also asked her why she was on the cover of magazines, including Forbes, which is honoring her as a mobile mogul. Despite capitalizing on her famous name and generating $160 million in revenue from her Kim Kardashian: Hollywood mobile game, Kardashian told the youngster, ""I don't know... I like magazines.”",2016-07-17 10:05:12
85,He crashes. ,https://www.washingtonpost.com/news/early-lead/wp/2015/12/29/mike-tyson-rides-a-hoverboard-and-yeah-you-can-guess-what-happens-next/,"Today’s Headlines

The most important news stories of the day, curated by Post editors and delivered every morning.

Email address

By signing up you agree to our Terms of Use and Privacy Policy",2016-07-15 12:49:00
86,Scarlett Johansson. ,http://boomhowdy.com/filmtv/the-highest-grossing-actress-of-all-time-has-been-revealed/,"244 SHARES Share Tweet

Renowned box office database Box Office Mojo has updated its highest-grossing actors & actresses chart, and this team player & leading lady has, for the time being, officially claimed the title of highest-grossing actress ever.

The data collected measures how much money films featuring a specific actor or actress have made domestically (in the US). This young lady’s films have pulled in a whooping $3.3 billion.

So who is she you ask?

Find out after the jump!",2016-07-15 09:41:33
87,Justic League. ,http://m.ign.com/articles/2016/06/06/justice-leagues-new-title-revealed,"The first entry in Warner Bros.' pair of upcoming Justice League films has dropped the ""Part One"" subtitle and will officially be called Justice League. DC chief creative officer—and newly appointed DC Films' co-head —Geoff Johns' took to Twitter , to confirm that ""the Justice League movie is called 'Justice League.'""

Loading

Loading

Just last week, several rumored titles surfaced , suggesting the film would either be called Justice League: Angels and Demons, Justice League: United, Justice League: Gods Among Us, or Justice League: Gods Among Men. What do you make of Warner Bros. and DC Films' decision to simply call the film Justice League? Let us know in the comments, and for more on the upcoming superhero flick ahead of its November 17, 2017 release, here's why Jeremy Irons believes the film won't be as ""muddled"" as Batman v Superman

Alex Osborn is a freelance writer for IGN. You can follow him on Twitter",2016-07-14 12:44:33
88,She Tweets a sad face emoji. ,https://toofab.com/2016/07/12/khloe-kardashian-reacts-to-lamar-odoms-drunken-plane-incident/,"Getty

Khloe Kardashian is feeling helpless after Lamar Odom's latest drunken incident.

The reality TV star's ex was escorted off a Delta airplane on Monday night at LAX, after he reportedly vomited in the galley, booked it to the bathroom to throw up again and emerged from the facilities with vomit on his clothes.

Khloe took to Twitter this morning to share her disappointment, posting a simple frowning emoji. She then started replying to her followers who were tweeting messages of concern and support ... and, at one point, even lashed out.

When one fan wrote, ""You're doing what you can, unfortunately he makes his own choices. Stay strong,"" Kardashian replied with, ""love you lots. Thank you.""

""You can't save every soul,"" wrote another. Khloe's response: ""But we like to try."" ""You can only do so much Khloe just pray,"" another added, to which she replied, ""amen.'

After another follower said ""it's out of your hands,"" she told them to ""just pray.""

Things got a little heated in another exchange, when someone tweeted at her writing, ""instead of running the streets with Mr.!steal your girl [Trey Songz] you need to be helping your HUSBAND."" ""Stay in your f--king lane little girl,"" Kardashian shot back. ""You know nothing about anything. You're a sheep herded by society.""

She ended her tweeting spree by telling one fan she was heading to the gym, writing, ""About to go work out and everything will be OK.""",2016-07-14 10:33:06
89,"Tebow may be signing with the Eagles.
He makes no announcements.
No one is furious.

",http://heavenscity.com/2016/07/09/athiests-are-furious-after-tim-tebow-makes-this-massive-announcement/,,2016-07-09 15:14:37
90,"She actually doesn't decide at all. The article leaves it completely up in the air, and mistakenly refers to Garner as ""Jennifer Aniston,"" so that's embarrassing.
",http://www.celebdirtylaundry.com/2016/jennifer-garner-decides-on-ben-affleck-divorce-to-split-or-reconcile/,"Ben Affleck and Jennifer Garner, will or won’t they divorce? Tabloids have been speculating for months now on the status of their marriage. The couple have been sending mixed signals to the press and public for almost as long, never providing any affirmative answer.

Jennifer Aniston and Ben Affleck celebrated their eleventh wedding anniversary this week and it’s been almost a year since they publicized their separation. The couple is still seen together with their children. Case and point, their family trip to London and Paris last month while Ben Affleck was filming Justice League.

Neither Ben nor Jen will confirm or deny the divorce allegations. Ben still calls Jennifer his “wife” as he did during an HBO interview with Bill Simmons last week. Despite his unusual appearance on Any Given Wednesday, Ben Affleck was very clear once more how supportive Jennifer Garner was of him while he rebuilt his career.

But as recent as three weeks ago, Jennifer Garner had plans on divorcing her husband. So does Ben’s HBO appearance mean he still hopes they can reconcile? Does he still believe he can get Jen to come around and change her mind and not finally file divorce papers?

According to an exclusive ET Online report, a source quotes that they are making it work. They also come right out and say that they don’t know if they will ever get a divorce: “They still have not officially filed paperwork for a divorce,” the source reiterates.

ET also noted since their split, the two have established a co-parenting routine with ben remaining close to Jen and the kids.

They’re still legally married, but separated. They both live on their property in Brentwood California. Another source told ET: “They’re in a good place and co-parenting the best they can.”

Confused? ET did it’s best to get to the bottom of this conundrum. Do Ben and Jen know what they’re intensions are? Do they share every relationship up and down with the press and let the tabloids write what they will? Or, do the pair have things worked out and simply tell the press what it wants to hear in order to keep their lives private and press distracted?

Radar Online has an interview with Jennifer’s father after the devastating floods that hit West Virginia. Her dad remains mum about the status of his daughter’s relationship, saying he’d leave it up to the couple to discuss their personal lives.

People Magazine has published two conflicting stories. One friend of Jennifer’s says: “nothing has changed” in the relationship: “They’re still all about putting the kids first.”

Yet another report states that Ben doesn’t want a divorce and Jen has denied to friends that they’ve reconciled. The friend also said that Jen doesn’t mind that the divorce hasn’t been finalized, but she still intends on going through with it.

And to pile on more confusion, the same friend said that Jen really enjoyed her time with Ben and their kids in Europe. She liked spending time with Ben again. And yet another source said: “They have a lot of admiration and respect for each other”

So which is it? Will they or won’t they divorce? Will Ben Affleck and Jen Garner continue to play this game with the press, teasing the tabloids while not really giving them an answer? Or is Jen dangling the reconciliation worm before ben and is ben the one who’s being jerked about?

What do you think is going on, CDL readers? Tell us in the comments. Keep your browser right here at CDL for all the latest celebrity gossip and news.

Jennifer Garner is seen departing on a flight at LAX airport in Los Angeles, California on June 30, 2016. It was one year ago today that Jennifer announced her split from Ben Affleck but their divorce is still not official. FameFlynet",2016-07-08 12:14:00
91,Added blonde highlights. #believeit ,http://www.inquisitr.com/3254251/you-wont-believe-what-ariana-grande-did-to-her-ponytail-now/,"Apparently, hair hoops are all the rage because Grande's fellow diva and pop artist Christina Aguilera debuted them back in May, as reported by Hollywood Life. Now, Grande's hairstylist is revealing to fans how they can get her sci-fi look.

""First prep the hair with Uberliss Hydrating Shampoo and Uberliss Hydrating Conditioner to add moisture and light weight to the hair,"" Appleton revealed.

Next, you blow dry your hair smooth, then curl each section with a 1 3/4 curling iron to create loose waves. Create a middle part in your hair, braid the middle, and add hair jewelry or jewels for interest. Then, take a section of your hair, from the ears to the crown, and tie it into a high ponytail.

""Finish using Ubeliss RituOil for hold and super shine,"" Ariana's hairstylist added. Meanwhile, Ariana's pink eyeshadow, black eyeliner, nude lips, and bold brows were done by her makeup artist Omar Rokael Lizama.",2016-07-07 12:12:00
92,He asked her to pay back the money from her 2005 settlement. ,http://www.bet.com/celebrities/news/2016/07/02/bill-cosby-s-bold-request.html,"Bill Cosby's fall from grace has been disturbing and far reaching, as the former comedian has been exposed for nearly 60 alleged sexual assaults against women over a course of decades. Now, it appears that Cosby and his legal team feel they have nothing to lose and are asking his accuser, Andrea Constand, to refund the money he paid her in a 2005 settlement, arguing that she and her lawyers violated the terms by cooperating in the criminal investigation against him.

The announcement came on Friday when Cosby's lawyers argued that the confidential settlement should be voided because the terms required Constand to tell him she was going to talk to police.

The 78-year-old comedian thinks that all the money, the amount of which is undisclosed, should be refunded. The judge didn't immediately rule on whether or not the supposed breach-of-contract suit could go forward.

While this recent announcement will do nothing for Cosby's public image, that aspect of his life maybe too far gone.

Cosby's legal team has been pursuing Constand and her lawyer, Dolores Troiani, ever since the deposition transcript was released.",2016-07-06 12:10:00
93,"July 22, 2016. ",http://www.cinemablend.com/news/1529909/when-star-wars-will-finish-filming-according-to-mark-hamill,"There are few franchises that truly inspire heavy fandom the way that Star Wars does. Since A New Hope first flew into theaters, American culture has been absolutely enamored with the galaxy far, far away, and entire generations have united together to watch the space opera and all of the colorful characters which it contains. As such, each new addition to the Star Wars canon is a cultural event, with droves of loyal viewers heading to the movies and attempting (sometimes in vain) to avoid spoilers. And since The Force Awakens was released in December, fans have been eagerly anticipating the next chapter of the main story, the still untitled Episode VIII. Luckily, we just got a little more information regarding the status of the next entry into the galaxy from none other than Luke Skywalker himself.

Mark Hamill has been pretty chatty regarding Episode VIII, most likely because he's actually in this movie for more than two minutes and actually has lines. Hamill most recently took to twitter to reveal when the cast and crew will be wrapping production for the untitled entry into the main canon, and it's real soon. Check it out.

See more

There you go, you scruffy looking nerf herders. Production wraps on the next entry into the saga that is Star Wars in less than a month. So hopefully we'll be able to see some footage or teasers sooner rather than later.

Production wrapping for Episode VIII so soon is seems both exciting and hopeful regarding the overall quality of the mysterious sequel. Since we are not expecting the movie to hit theaters for another year and a half, this gives the producers, editors, and visual effects coordinators plenty of time to really make the film outstanding. The Force Awakens was gorgeous and felt like a chapter from the original trilogy, so Episode VIII will presumably attempt to do the same.

Rather than having to rush to quickly produce a movie for this December, the standalone film Rogue One: A Star Wars Story will be released this year. The spinoff will successfully continue the hype and excitement for Star Wars fans, while also allowing post-production for Episode VIII to occur properly. Additionally, Rogue One will allow fans of the original trilogy (aka everyone) to go back in time a bit, and be re-introduced to the original characters that made the property so exciting.

Rogue One: A Star Wars Story will fly into theaters on December 16h, 2016.",2016-07-03 17:33:01
94,Squirrel Girl. ,http://comicbook.com/marvel/2016/07/01/anna-kendrick-reveals-the-surprising-marvel-character-that-she-w/,"Everybody wants to be a hero these days. Comedic actress Anna Kendrick is no exception.

Kendrick, who has Mike & Dave Need Wedding Dates hitting theaters in a few weeks, may not know much about comics or super heroes but she does have on particular Marvel character in mind should she ever suit up.

""My brother sent me a Squirrel Girl comic because he thinks I should [play her],"" Kendrick tells Net-A-Porter. ""I don't know what Squirrel Girl does other than be half squirrel, but I could be half squirrel!""

Kendrick would probably be a great fit for the ambitious and spunky Doreen Green. Her first encounter with Iron Man, when Squirrel Girl tries to impress him and convince him to let her join his super hero escapades, would be a blast having Kendrick riffing with Robert Downey Jr..

The inspiration to play a hero does have a source for Kendrick: Ryan Reynolds. ""Ryan is one of the most authentic people I've worked with; I can't think of a person more deserving of a hit like [Deadpool],"" the actress explains. ""He worked for so many years to get that film made because it's a character that was inside of him.""

Deadpool was very much a labor of love for Reynolds who pushed to get the movie made for years on end. It wasn't until some test footage leaked and the Internet went wild in support of a Deadpool film that Reynolds got to bring the character many say he was born to play to life on the big screen.

Will the same be said of Kendrick and Squirrel Girl?

(via CinemaBlend)",2016-07-01 10:05:53
95,Sings show tunes. ,http://www.instyle.com/celebrity/what-nick-jonas-does-shower,"Naked dresses are perhaps the most impressive of all red carpet feats. While they may not always make the best-dressed list, they do require a certain breed of celebrity to pull off. Not only do you have to have the balls to risk a wardrobe malfunction, but you have to do it with enough confidence that you look fierce — not terrified — in the photographs. Take Naomi Campbell's appearance in Valentino's couture show during the spring/summer 2019 presentation. The legendary model gracefully strutted down the runway in a see-through gown with a ruffle skirt. (Click through the gallery for the NSFW photo). Get the inside scoop on all your favorite celebrities with our FREE daily newsletter, InStyle Celebrity. Breaking news, relationship updates, hairstyle inspo, fashion trends, and more direct to your inbox! Let's not forget Rihanna’s infamous CFDA dress either. The girl rocked a completely sheer dress without a bra — and later remarked that her only regret was not wearing a bedazzled thong to match. That, my friends, is dedication. Then, there was the year 2015, when the Met Gala saw not one nor two but three naked dresses on the red carpet, all worn by Hollywood’s hottest A-listers. Jennifer Lopez, above, bared her famous curves in a custom Atelier Versace illusion gown. Beyoncé was nearly naked in Givenchy. And Kim Kardashian West almost looked modest in comparison in her sheer Roberto Cavalli dress, because no one’s getting naked without KKW joining in. Click through to see the best naked dresses of all time.",2016-06-29 11:36:00
96,"Vincent Desiderio thinks Kanye West is ""a remarkable man."" He goes on: ""Fundamentally, he’s an artist and I have total respect for him."" ",http://time.com/4384498/artist-vincent-desiderio-kanye-west-famous-video-sleep/,"Kanye West’s controversial video for “Famous” has been making headlines for its nude depiction of celebrities like Taylor Swift, Rihanna, George W. Bush, Donald Trump, Amber Rose, and Ray J tangled up in bed together, in a bizarre but intriguing tableaux of his oft-dramatic relationships with other celebrities. See the NSFW comparison here.

However, West, the self-proclaimed “greatest artist of all time” pulled major visual inspiration from another artist — realist painter Vincent Desiderio, whose 2004 piece, “Sleep” debuted at New York’s Marlborough Gallery and was later completed in 2008.

In an interview with Cosmopolitan, Desiderio — who is also a visiting critic at the Pennsylvania Academy of Fine Arts — reveals that he was not only supportive of the rapper’s artistic vision, but that he was happy with the end result.

“It’s an extraordinary and bold and different move for Kanye West,” he said. “And what I would say is that it is the clearest indication of his overall intentions as a person utilizing the media and working within it. I was absolutely floored and incredibly flattered and incredibly happy to see the video, which I think is really beautiful.”

Desiderio also disclosed that he found a kindred creative spirit with West, whom he respects as an artist in his own right.

“I think he and I are on the same page and he knows that, I know that. We both acknowledge that we are one brain, two bodies. He’s quite a remarkable man, not withstanding all the nonsense that accompanies a man strapped to a rocket, who sometimes is either misquoted or is compelled into a position that can frustrate someone.

Think of how Andy Warhol was intentionally misconstrued because he put himself out there to be misconstrued. Think about how his whole life was a performance piece and then you understand why Kanye at one point said, ‘I’m Andy Warhol.’ The way we’re thinking about Kanye West and the way he’s portrayed, there’s an orchestration to it, but social media is so large right now that it spins wildly out of control. Fundamentally, he’s an artist and I have total respect for him.”

Write to Cady Lang at cady.lang@timemagazine.com.",2016-06-28 07:10:08
97,Take walks on beaches. ,http://time.com/4384106/taylor-swift-tom-hiddleston-photos-beach/?xid=time_socialflow_facebook,"Neither Kanye West’s very naked “Famous” video nor the controversial Brexit results could keep Taylor Swift and Tom Hiddleston from celebrating the 2-week anniversary of their very well-documented, budding romance in the United Kingdom this weekend with what appears to be their favorite activity: beach strolling.

The pair paid homage to their first outing as a couple by replicating their Rhode Island beach jaunt on the beaches of Suffolk, with not just one long walk on the beach, but two during a whirlwind 24-hour trip to the U.K.

According to the Daily Mail, the singer flew Hiddleston out to the U.K. on her private jet, accompanied by five bodyguards, because a getaway with an entourage is nothing if not very romantic. The pair then fittingly rented a “Bond-inspired” Jaguar and visited Hiddleston’s old stomping grounds, taking time to stroll on the beach with Hiddleston’s mother and sister.

As with all outings since this blossoming relationship started, it was faithfully documented by the paparazzi at a very close proximity, which is a real boon since Taylor has adopted a charming English country style since linking up with Hiddleston.

Stay tuned for more beach dispatches from Team Hiddleswift; after all, a couple that walks beaches together will probably, maybe stay together.

Write to Cady Lang at cady.lang@timemagazine.com.",2016-06-28 06:39:11
98,She left when she saw Beyonce enter the building. ,http://www.bet.com/celebrities/news/2016/06/08/rachel-roy-fled-beyonce.html,"Rachel Roy has been in hiding ever since she was outed as being the home wrecker on Beyoncé 's Lemonade , so we were all surprised when the designer and pop icon were both spotted at the same event this week: the CFDA Fashion Awards, where Bey was given the Icon Award. Well, turns out, ""Becky"" took her good hair and ran straight out the building as soon as she saw Queen Bey coming.

According to Page Six, Rachel Roy hastily left the building as soon as rumors started circulating that the Carters were dropping in on the event unexpectedly — of course, it's not like Bey would RSVP — to avoid Bey's death stare.

Whispers of the Carters surprise arrival started as soon as the lights went down. One fashion writer tweeted, “Jay Z has just arrived... What could it mean?” Then Beyoncé’s daughter, Blue Ivy, and mom, Tina Knowles Lawson, showed up, making it clear that the Queen was on her way.

Roy, apparently, took that as her cue and dashed before Beyoncé entered the building. “She disappeared with her place card and never came back,” said a source. ""[It was] weird. I don’t know if it was because she’s ‘Becky,’ or what?” Another stunned source at the event said, “Rachel just came and left.”

While Rachel's official excuse is that she had to catch an early flight to LA to be with her kids, this latest display of bizarre behavior isn't doing anything to squash those Becky rumors.

We would say let this be a lesson to anyone who crosses Beyoncé, but that's already perfectly clear.

Relive the Becky drama with BET Breaks, above.",2016-06-27 14:18:00
99,He (jokingly) suggested it's because of Kate's bad cooking. ,http://indiatoday.intoday.in/story/kate-middleton-prince-william-secret-behind-lean-physique-slim-body-lifest/1/699290.html,"Like always, the two look regal together. Picture courtesy: Instagram/@catherinemiddleton_duchess

Prince William and Kate Middleton are always busy attending events and while any pictures of them together are enough to make the fans of the British royals go awww, it's moments like these when one gets an insight into the couple's camaraderie that are relationship gold.

Also read: Feeling Blue: Kate Middleton finds a way to rock the colour, thrice over

While attending an evening hosted at the residence of their friends, the Marquess and Marchioness of Cholmondeley, the couple indulged in light banter, during which the two ended up revealing Prince William's secret to his lean physique.

According to People, while talking to the Michelin-star chefs at the event, Kate commented that, ""William was looking forward to a break from her cooking when the couple attended the gala dinner.""

She said, ""William has to put up with my cooking most of the time.""

Also read: Take a look at Princess Charlotte's first public appearance on the Buckingham Palace's famous balcony

Not missing an opportunity to throw a jibe his wife's way, William said, ""It's the reason I'm so skinny.""

We guess the reason lies in his desire to keep up with Ms K herself, rather than the cooking.",2016-06-27 11:18:53
